{
  "schema_version": "1.0",
  "kind": "command-definition",
  "id": "test.TASK-021",
  "argv": [
    "python",
    "-m",
    "unittest",
    "discover",
    "-s",
    "tests/unit/orchestration_dispatch/",
    "-p",
    "test_*.py"
  ],
  "cwd_rule": "worktree",
  "timeout_seconds": 180,
  "max_output_bytes": 1048576,
  "permission_class": "local_execute",
  "environment_bindings": [],
  "shell": false,
  "platforms": [
    "linux",
    "windows"
  ],
  "success_rule": "unittest_nonzero_count"
}
